{
  "schema_version": "attestation.envelope.v0.1",
  "subject": {
    "root_cid": "bafyreifyfdhtyxiqponnoyme3bketuyv4uyh57tqghccl2kdhj2fsfh6oa",
    "descriptor_cid": "bafyreiccjc3fghpvbnh22aurk7uz7s2va25wyiiqtntvqk3cd3jz7dpmwi",
    "cid_profile": {
      "name": "mcp.cidprofile.default",
      "version": "1",
      "hash": "sha2-256",
      "codec": "dag-cbor",
      "base": "base32",
      "normalization": {
        "path_separator": "/",
        "sort_entries": true,
        "strip_timestamps": true,
        "strip_owner": true,
        "strip_permissions": true,
        "reject_symlinks": true
      }
    }
  },
  "claims": [
    {
      "type": "mcp.claim.integrity",
      "issued_at_utc": "2026-01-30T21:00:00Z",
      "issuer": {
        "key_id": "did:key:z6MkezcXcwofjwGsCmDCEW3pfXeRihWda2JwD6uooPNSCvDs",
        "role": "verifier"
      },
      "payload": {
        "kind": "integrity",
        "verified_root_cid": "bafyreifyfdhtyxiqponnoyme3bketuyv4uyh57tqghccl2kdhj2fsfh6oa",
        "verified_descriptor_cid": "bafyreiccjc3fghpvbnh22aurk7uz7s2va25wyiiqtntvqk3cd3jz7dpmwi"
      }
    }
  ],
  "signatures": [
    {
      "key_id": "did:key:z6MkezcXcwofjwGsCmDCEW3pfXeRihWda2JwD6uooPNSCvDs",
      "alg": "ed25519",
      "sig": "AU1dk_VecPlM_Ho8pLe-ZrvvF_cuQjxE6qPvZJBCkzimjl6l8L6B4qL3TAv0B44OSAI7NnPpiw6Cire1ZGYoDw",
      "signed_fields": [
        "/subject",
        "/claims"
      ]
    }
  ]
}
