{"claims":[{"issued_at_utc":"2026-01-30T21:00:00Z","issuer":{"key_id":"did:key:z6MkhaXgBZDvotDkL5257faiztiGiC2QtKLGpbnnEGta2doK","role":"verifier"},"payload":{"kind":"integrity","verified_descriptor_cid":"bafybeigdyrzt5sfp7udm7hu76uh7y26nf3efuylqabf3oclgtqy55fbzdi","verified_root_cid":"bafybeigdyrzt5sfp7udm7hu76uh7y26nf3efuylqabf3oclgtqy55fbzdi"},"type":"mcp.claim.integrity"}],"schema_version":"attestation.envelope.v0.1","signatures":[],"subject":{"cid_profile":{"base":"base32","codec":"dag-cbor","hash":"sha2-256","name":"mcp.cidprofile.default","normalization":{"path_separator":"/","reject_symlinks":true,"sort_entries":true,"strip_owner":true,"strip_permissions":true,"strip_timestamps":true},"version":"1"},"descriptor_cid":"bafybeigdyrzt5sfp7udm7hu76uh7y26nf3efuylqabf3oclgtqy55fbzdi","root_cid":"bafybeigdyrzt5sfp7udm7hu76uh7y26nf3efuylqabf3oclgtqy55fbzdi"}}